form,meaning,type,etymology
泵,to pump,ideographic,To pull water 水 out of stone 石
洄,backwater; an eddy a whirlpool,ideographic,Swirling 回 water 氵; 回 also provides the pronunciation
洇,"to soak; to blot, to splotch",pictophonetic,water
洋,"sea, ocean; western, foreign",pictophonetic,water
洌,"clear, pure; to cleanse",pictophonetic,water
洎,"when, until; to soak; soup",pictophonetic,water
洗,"to bathe, to rinse, to wash",pictophonetic,water
洙,a river in Shandong province,pictophonetic,water
洚,flood,pictophonetic,water
洛,a river in the Shanxi province; a city,pictophonetic,water
洞,"cave, grotto, hole, ravine",pictophonetic,water
洣,a river in Hunan province,pictophonetic,water
津,"saliva, sweat; ferry, ford",pictophonetic,water
洧,a river in Henan province,pictophonetic,water
洨,a river in Hebei province,pictophonetic,water
洪,"deluge, flood; immense, vast",ideographic,All 共 the water 氵; 共 also provides the pronunciation
洫,"moat, ditch",pictophonetic,water
洮,to cleanse; a river in Gansu province,pictophonetic,water
洱,a lake in Yunnan province,pictophonetic,water
洲,continent; island,ideographic,A state 州 surrounded by water 氵; 州 also provides the pronunciation
洳,"sdamp, boggy, marshy",pictophonetic,water
洵,"true, real; truly, really",pictophonetic,water
汹,"turbulent, torrential, restless",pictophonetic,water
洹,a river in Henan province,pictophonetic,water
活,"to exist, to live, to survive; living, working",pictophonetic,water
洼,"pit, hollow, depression; swamp",pictophonetic,water
洽,"to mix, to blend, to harmonize",ideographic,To combine 合 two solutions 氵
派,"clique, faction, group, sect",,
流,"to flow, to drift, to circulate; class",pictophonetic,water
浙,the Zhejiang province; a river,pictophonetic,water
浚,to dredge,pictophonetic,water
浜,"creek, stream; beach, coast",pictophonetic,water
浞,"to soak, to steep in water",pictophonetic,water
浠,a river in Hubei province,pictophonetic,water
浣,"to wash, to rinse",pictophonetic,water
浦,"beach, shore, river bank; surname",pictophonetic,water
浩,"great, grand, vast",pictophonetic,water
浪,"breaker, wave; reckless, wasteful",pictophonetic,water
浮,"to drift, to float; mobile, temporary, unstable; reckless",pictophonetic,water
浯,a river in Shandong province,pictophonetic,water
浴,"to bathe, to shower, to wash",pictophonetic,water
海,"sea, ocean; maritime",pictophonetic,water
浸,"to dip, to immerse, to soak; to percolate, to steep",pictophonetic,water
浃,"to saturate, to drench; wet, damp",pictophonetic,water
浼,"to request, to ask a favor; to pollute, to contaminate",pictophonetic,water
浽,"drizzle, light rain",pictophonetic,water
涅,"to blacken; slime, black mud",pictophonetic,water
泾,a river in Gansu and Shaanxi,pictophonetic,water
消,"news, rumors; to die out, to melt away, to vanish",pictophonetic,water
涉,"sconcerned, involved; to experience; to wade through a stream",ideographic,To wade 步 through a stream 氵
涌,"to surge up, to bubble up, to gush forth",pictophonetic,water
涑,a river in Shansi province,pictophonetic,water
涓,"brook, stream; pure; to select",pictophonetic,water
涔,to overflow; rainwater; a river in Shaanxi province,pictophonetic,water
涕,tears; mucus,pictophonetic,water
莅,"attend, be present; arrive at",ideographic,A place 位 where grass 艹 grows; 立 also provides the pronunciation
涪,a river in Sichuan province,pictophonetic,water
涫,to boil,pictophonetic,water
涮,to rinse; to boil or cook in juice,pictophonetic,water
涯,"border, horizon; river bank, shore",pictophonetic,water
液,"fluid, liquid; juice, sap",pictophonetic,water
涵,"to wet, to soak; to tolerate, to include lenient",pictophonetic,water
涸,"tired, exhausted; dried up",ideographic,To run out 氵 of strength 固; 固 also provides the pronunciation
凉,"cool, cold; disheartened",pictophonetic,ice
涿,"to trickle, to dribble, to drip",pictophonetic,water
淀,"marsh, swamp; sediment; to precipitate",pictophonetic,water
淄,a river in Shandong province,pictophonetic,water
淅,water used wash rice,pictophonetic,water
淇,a river in Henan province,pictophonetic,water
淋,"to drench, to drip, to soak; perfectly",pictophonetic,water
淌,"to trickle down, to flow, to drip; to shed tears",pictophonetic,water
淑,"good, pure, virtuous; charming",pictophonetic,water
淖,"mud, slush",pictophonetic,water
淘,"to dredge, to sieve; to cleanse, to weed out",pictophonetic,water
淙,the sound of water gurgling,pictophonetic,water
泪,"tears; to cry, to weep",ideographic,Water 氵 from the eyes 目
淝,an affluent of the Poyang Lake,pictophonetic,water
淞,a river in Jiangsu province,pictophonetic,water
淠,luxuriant; water lily,pictophonetic,water
淡,"watery, dilute; insipid, tasteless",pictophonetic,water
淤,"mud, sediment; to clog up, to silt up",pictophonetic,water
渌,to strain,pictophonetic,water
淦,a river in Jiangxi province; water leaking into a boat,pictophonetic,water
淩,"to cross, to traverse, to pass through",pictophonetic,water
沦,"sunk, submerged; to perish, to be lost",pictophonetic,water
淫,"obscene, licentious, lewd, kinky",,
淬,"to soak, to dye; to temper, to change",pictophonetic,water
淮,a river in Anhui province,pictophonetic,water
淯,a river in Henan province,pictophonetic,water
淳,"simple, honest, genuine",pictophonetic,water
渊,"abyss, depth; to surge up, to bubble up",pictophonetic,water
涞,ripple; brook; a river in Hebei province,pictophonetic,water
混,"muddy, confused; to mix, to blend; to mingle",pictophonetic,water
淹,"to drown, to immerse, to steep",pictophonetic,water
浅,"shallow, superficial",pictophonetic,water
添,"to add, to append, to increase, to replenish",pictophonetic,water
淼,infinity; flooding; a wide expanse of water,ideographic,Water 水 everywhere
清,"clean, pure; clear, distinct; peaceful",pictophonetic,water
渖,"water, liquid, juice; to pour",pictophonetic,water
涣,scattered; to scatter,pictophonetic,water
渚,"islet, sandbar",pictophonetic,water
减,"to decrease, to subtract, to diminish",pictophonetic,ice
渝,to change; Chongqing,pictophonetic,water
渠,"ditch, gutter; canal, channel",ideographic,A ditch 洰 made of wood 木; 洰 also provides the pronunciation
渡,"to cross, to ferry over, to pass through",pictophonetic,water
渣,"dregs, sediment; refuse, slag",pictophonetic,water
渤,swelling; the Bohai sea,pictophonetic,water
渥,"to enrich, to dye; to moisten, to soak",pictophonetic,water
涡,"eddy, swirl, whirlpool",ideographic,A mouth 呙 made of water 氵
渫,"to scatter, to disperse; high tide",pictophonetic,water
测,"to survey, to measure; to estimate, to conjecture",pictophonetic,water
渭,a river in Shanxi province,pictophonetic,water
港,"port, harbor, bay; Hong Kong",pictophonetic,water
渲,"to render; to exaggerate, to embellish, to add layers of color",pictophonetic,water
渴,"thirsty, parched; to yearn, to pine for",pictophonetic,water
游,"to wander, to travel, to tour, to roam",ideographic,To swim freely 斿 through the seas 氵
渺,"vast, boundless",pictophonetic,water
浑,"blended, mixed; muddy, turbid",pictophonetic,water
湃,"turbulent, surging; the sound of waves crashing",pictophonetic,water
湄,"bank, coast, shore",pictophonetic,water
湉,flowing smoothly; calm water,ideographic,Calm 恬 water 氵; 恬 also provides the pronunciation
凑,"to piece together, to assemble",pictophonetic,ice
湍,"current, rapids",pictophonetic,water
湎,"drunk, flushed",ideographic,A man's face 面 after drinking 氵; 面 also provides the pronunciation
湓,an affluent of the Yangtze river,pictophonetic,water
湔,"to wash, to cleanse; to purge",pictophonetic,water
湖,"lake; Hubei, Hunan; bluish-green",pictophonetic,water
湘,Hunan province; the Xiangjiang river,pictophonetic,water
湛,"calm, clear, deep (as of a lake)",ideographic,A deep 甚 lake 氵; 甚 also provides the pronunciation
浈,a river in Guangdong province,pictophonetic,water
湟,river in Qinghai province,pictophonetic,water
湣,"confused, mixed; to pity",pictophonetic,water
湫,"marsh, swamp, small pond",pictophonetic,water
湮,to block up; to sink; to stain,ideographic,A dammed 垔 stream 氵; 垔 also provides the pronunciation
汤,"soup, gravy, broth; hot water",pictophonetic,water
湴,"mud, mire",pictophonetic,water
沩,a river in Shanxi province,pictophonetic,water
溉,"to water, to irrigate, to flood; to wash",pictophonetic,water
溏,"pool, pond; not hardened, semi-soft",pictophonetic,water
源,"spring; source, root, head; surname",pictophonetic,water
溘,"sudden, abrupt, unexpected",pictophonetic,water
溜,"to slip, to slide, to glide; slippery",pictophonetic,water
沟,"ditch, drain, gutter, narrow waterway",pictophonetic,water
溟,"drizzling rain; dark, obscure",ideographic,A gloomy 冥 rainy 氵 day
溢,full; overflowing,pictophonetic,water
溥,"big, great, vast; extensive, pervading, widespread",pictophonetic,water
溦,to drizzle,pictophonetic,water
溧,a river in Anhui and Jiangsu provinces,pictophonetic,water
溪,"brook, creek, stream",pictophonetic,water
温,"warm, lukewarm",pictophonetic,water
浉,a river in Henan province,pictophonetic,water
溯,"to paddle upstream, to go against the current; to trace the source; formerly",ideographic,To seek the source 朔 of a river 氵
溱,a river in Henan province,pictophonetic,water
溲,"to urinate; to soak, to drench",pictophonetic,water
溴,bromine,ideographic,A noxious 臭 liquid 氵; 臭 also provides the pronunciation
溶,"to melt, to dissolve",pictophonetic,water
溷,"privy, latrine; turbid, dirty",ideographic,Water 氵 flowing through a pig-sty 圂; 圂 also provides the pronunciation
溺,"to spoil, to pamper, to indulge; to drown",pictophonetic,water
溻,wet,pictophonetic,water
湿,"wet, moist, humid, damp; illness",pictophonetic,water
溽,"moist; humid, muggy",pictophonetic,water
滁,a district in Anhui province,pictophonetic,water
滂,torrential; voluminous,pictophonetic,water
沧,"azure, cold, vast (all as of the sea)",pictophonetic,water
灭,to extinguish; to wipe out,ideographic,To cover 一 a flame 火
滇,Yunnan province,pictophonetic,water
滊,saline pond; the name of a river,pictophonetic,water
滋,"to grow, to nourish; to multiply, to thrive",pictophonetic,water
涤,"to wash, to sweep; to purify, to cleanse",pictophonetic,water
荥,a county in Henan; the sound of waves crashing,pictophonetic,water
滏,a river in Hebei province,pictophonetic,water
滑,"to slip, to slide; slippery, polished",pictophonetic,water
滓,"sediment, lees, dregs",pictophonetic,water
滔,"torrential, rushing, overflowing",pictophonetic,water
滕,an ancient state in Shandong province,,
沪,Shanghai; the Shanghai river,pictophonetic,water
滞,"to block, to obstruct; sluggish, stagnant",pictophonetic,water
渗,"to seep, to permeate, to infiltrate",pictophonetic,water
滴,to drip; a drop of water,pictophonetic,water
卤,salt,pictographic,A container used to brine pickles
浒,"shore, river bank",pictophonetic,water
滹,the bank of a stream,pictophonetic,water
浐,a river in Shaanxi province,pictophonetic,water
滚,"to boil, to roll, to turn",pictophonetic,water
满,"to fill; full, packed; satisfied",pictophonetic,water
渔,fisherman; to fish; to pursue; to sieze,ideographic,To fish 鱼 in a river氵; 鱼 also provides the pronunciation
漂,"to drift, to float; to be tossed about; bleach",pictophonetic,water
漆,"varnish, lacquer; paint",ideographic,The sap 氵 of the varnish tree 桼; 桼 also provides the pronunciation
漉,"to filter, to strain; dripping, wet",pictophonetic,water
漏,"to leak, to drip; hour glass; funnel",ideographic,Water 氵 falling like raindrops 雨; 屚 provides the pronunciation
漓,dripping water; a river in Guangxi province,pictophonetic,water
演,"to perform, to act, to put on a play",pictophonetic,water
漕,"canal, watercourse; to transport by sea",pictophonetic,water
沤,"to soak, to steep; sodden, soaked",pictophonetic,water
漠,"desert; aloof, cool, indifferent",pictophonetic,water
汉,Chinese people; Chinese language,ideographic,Simplified form of 漢; the Han 𦰩 river 氵
涟,flowing water; ripples; weeping,pictophonetic,water
漤,to marinate in salt,pictophonetic,water
漩,"eddy, whirlpool",ideographic,Swirling 旋 water 氵; 旋 also provides the pronunciation
漪,ripples; swirling water,pictophonetic,water
漫,inundating; exaggerated,pictophonetic,water
渍,"to soak, to steep; dye, stains; sodden",pictophonetic,water
漭,"vast, expansive",pictophonetic,water
漯,a river in northern Shandong,pictophonetic,water
漱,"to gargle, to rinse; to wash, to scour",ideographic,To gargle 欶 water 氵; 欶 also provides the pronunciation
涨,flood tide; to rise in price,pictophonetic,water
漳,a river in Henan province,pictophonetic,water
溆,a river in Hunan,pictophonetic,water
漶,indecipherable,pictophonetic,water
渐,gradually,pictophonetic,water
漼,to appear deep,ideographic,A deep 崔 pool 氵; 崔 also provides the pronunciation
漾,"to ripple, to undulate; to bob on the waves",pictophonetic,water
浆,"pulp, starch, syrup; a thick fluid",pictophonetic,water
颍,a river in Anhui,pictophonetic,water
泼,"to pour, to splash, to sprinkle, to water",ideographic,To send forth 发 water 氵
洁,"clean, pure; to purify, to cleanse",pictophonetic,water
潘,a river that flows into the Han; surname,pictophonetic,water
潜,"to hide; secret, latent, hidden",pictophonetic,water
潞,a river in northern China,pictophonetic,water
潟,"salt marsh, scrubland",pictophonetic,water
潢,"pond, lake",pictophonetic,water
润,"fresh, moist; soft, sleek",pictophonetic,water
潦,"to flood; puddle; dejected, careless",pictophonetic,water
潭,"deep pool, lake; deep, profound",pictophonetic,water
潮,"tide, current; damp, moist, wet",pictophonetic,water
浔,steep river bank,pictophonetic,water
溃,"a flooding river; a military defeat; to break down, to disperse",pictophonetic,water
潲,to sprinkle; driving rain,ideographic,A little 稍 water 氵; 稍 also provides the pronunciation
滗,to drain,pictophonetic,water
潸,tearful; to weep,ideographic,Water 氵 falling from closed eyes 林
潺,the sound of flowing water,pictophonetic,water
潼,"high, lofty; a mountain pass",pictophonetic,water
潽,to boil over,pictophonetic,water
涠,still water,pictophonetic,water
涩,"astringent, harsh, rough, uneven",ideographic,Water 氵 that cuts like a knife 刃; 止 provides the pronunciation
澄,"clear, limpid, pure",pictophonetic,water
浇,"to spray, to sprinkle, to water",pictophonetic,water
涝,"to inundate, to flood; torrent",pictophonetic,water
澈,"limpid, clear; thoroughly, completely",pictophonetic,water
澉,to wash; a place name,pictophonetic,water
澌,"to vanish, to disappear; to exhaust, to dry up",pictophonetic,water
澍,timely and life-giving rain,ideographic,Rain 氵 that saves 尌 the farm; 尌 also provides the pronunciation
澎,to splatter,pictophonetic,water
渑,the name of a river in Shandong,pictophonetic,water
澡,"to wash, to bathe",pictophonetic,water
泽,"marsh, swamp; brilliance, grace",pictophonetic,water
澥,gulf; a blocked stream,pictophonetic,water
澧,a river in northern Hunan,pictophonetic,water
浍,"ditch, trench, irrigation canal; river",pictophonetic,water
澳,"bay, cove, dock, inlet",pictophonetic,water
澶,"still water; tranquil, placid",pictophonetic,water
澹,"calm, quiet, tranquil",pictophonetic,water
激,"to arouse, to incite; acute, sharp; fierce, violent",pictophonetic,water
浊,"dirty, filthy, muddy, turbid",ideographic,A pond 氵 growing scum 虫
濂,a waterfall; a river in Hunan,pictophonetic,water
浓,"concentrated, dense, strong, thick",pictophonetic,water
濉,the name of a river,pictophonetic,water
濊,"vast, expansive, deep; dirty",pictophonetic,water
泞,"mud, mire; muddy, stagnant",ideographic,Still 宁 water 氵; 宁 also provides the pronunciation
蒙,to cover; to deceive; Mongolia,pictophonetic,plant
濞,a county in Yunnan province,pictophonetic,water
济,"to aid, to help, to relieve; to ferry across",pictophonetic,water
濠,"ditch, trench, moat",pictophonetic,water
濡,"to moisten, to immerse; wet, damp",pictophonetic,water
涛,large waves,pictophonetic,water
滥,"to flood, to overflow; excessive",pictophonetic,water
濮,a county in Henan province,pictophonetic,water
濯,"to cleanse, to rinse, to wash out",pictophonetic,water
潍,a river in Shandong province,pictophonetic,water
滨,"beach, coast, river bank",pictophonetic,water
阔,"ample, broad, wide; separate; to be apart",pictophonetic,gate
溅,"to sprinkle, to spray, to splash, to spill",pictophonetic,water
泺,a river in Shandong province,pictophonetic,water
滤,"to filter, to strain",pictophonetic,water
滢,"clear, pure; glossy; lucid",ideographic,A sparkling 莹 lake 氵; 莹 also provides the pronunciation
渎,"ditch, sluice, gutter, drain",pictophonetic,water
泻,to leak; diarrhea,pictophonetic,water
浏,bright; clear; deep; swift,pictophonetic,water
瀑,"waterfall, cascade; heavy rain",ideographic,Violent 暴 water 氵; 暴 also provides the pronunciation
濒,"to approach; near, on the verge of",pictophonetic,water
泸,a river in Jiangxi province,pictophonetic,water
瀚,"wide, vast, extensive",pictophonetic,water
瀛,"ocean, sea",pictophonetic,water
沥,"trickle, drip, dregs; to strain",pictophonetic,water
潇,the sound of beating wind and rain,pictophonetic,water
潆,eddy; small river,ideographic,Water 氵 coiling 萦 on itself; 萦 also provides the pronunciation
瀣,"vapor, sea mist",pictophonetic,water
潴,"pond, pool",pictophonetic,water
泷,"raining; wet, soaked; rapids; a river in Guangdong",pictophonetic,water
濑,"current, rapids",pictophonetic,water
潋,"ripples, waves; to overflow",pictophonetic,water
瀵,the name of a river,pictophonetic,water
瀹,"to boil, to soak; to cleanse, to wash",pictophonetic,water
澜,"overflowing; ripples, waves",pictophonetic,water
沣,a river in Shanxi province,pictophonetic,water
滠,a river in Hubei province,pictophonetic,water
灌,"to water, to irrigate; to pour; to flood",pictophonetic,water
洒,"to pour, to spill; to scatter, to shed; to wipe away",pictophonetic,water
滩,"rapids; sandbar, shoal",ideographic,Difficult 难 waters 氵 to navigate; 难 also provides the pronunciation
灏,"vast, large, grand, expansive",pictophonetic,water
灞,a river in Shanxi province,pictophonetic,water
湾,"bay, cove, gulf, inlet",pictophonetic,water
滦,a county and river in Hebei province,pictophonetic,water
赣,Jiangxi province; places therein,pictophonetic,go
滟,"billowing, overflowing; wavy",ideographic,Curves 艳 in the water 氵; 艳 also provides the pronunciation
火,"fire, flame; to burn; anger, rage",pictographic,Flames
灬,fire,,
灰,"ashes; dust; lime, mortar",ideographic,The remains of a fire 火; 火 also provides the pronunciation
灶,"kitchen, oven, stove",ideographic,A clay 土 oven 火
灸,to cauterize; moxibustion,pictophonetic,fire
灼,"to burn, to cauterize; bright",pictophonetic,fire
灾,"disaster, catastrophe, calamity",ideographic,A house 宀 on fire 火
炅,"brilliant, shining",ideographic,A flame 火 as bright as the sun 日
炆,"to simmer, to cook over a slow fire",pictophonetic,fire
炊,"meal; to cook, to steam",pictophonetic,fire
炎,"flame, blaze; hot",ideographic,Two fires 火 burning
炏,grass,pictographic,Two blades of grass; compare 艸
炒,"to boil, to fry, to roast, to sauté; to trade stock",pictophonetic,fire
炔,acetylene,pictophonetic,fire
炙,"to roast, to broil; to cauterize",pictophonetic,fire
炤,"to illuminate, to light up; to reflect",pictophonetic,fire
照,"to shine, to reflect, to illuminate",pictophonetic,fire
炫,"to glitter, to shine; to show off, to flaunt",pictophonetic,fire
炬,torch,pictophonetic,fire
炭,"carbon, charcoal, coal",pictophonetic,ashes
炮,"cannon, artillery",pictophonetic,fire
炯,"bright, brilliant; clear; hot",pictophonetic,fire
炱,soot,pictophonetic,fire
炳,"bright, luminous; glorious",pictophonetic,fire
炷,candle wick; incense,ideographic,A lit 火 candle 主; 主 also provides the pronunciation
炸,to explode; to fry in oil; to scald,ideographic,A sudden 乍 flame 火; 乍 also provides the pronunciation
为,"to do, to act; to handle, to govern; to be",,
炻,"china, stoneware",ideographic,Fired 火 clay 石; 石 also provides the pronunciation
烀,"to simmer, to cook over a slow fire",pictophonetic,fire
烈,"fiery, violent; ardent, vehement",pictophonetic,fire
烊,to smelt; to close for the night,pictophonetic,fire
乌,"crow, rook, raven; black, dark",pictographic,Simplified form of 烏; a crow; compare 鸟
烕,"to destroy, to exterminate, to extinguish",ideographic,To smother 戊 a flame 灭; 灭 also provides the pronunciation
烘,"to bake, to roast; to dry by the fire",pictophonetic,fire
烙,"to burn, to brand; hot iron",pictophonetic,fire
烜,sunlight; to dry in the sun,ideographic,To bake 火 in the sun 亘; 亘 also provides the pronunciation
烝,"to rise; steam; many, numerous",ideographic,Boiling 灬 water 氶
烤,"to bake, to cook, to roast, to toast",pictophonetic,fire
烯,alkene,pictophonetic,fire
烃,hydrocarbon,pictophonetic,fire
烷,alkane,pictophonetic,fire
烹,"cooking, cuisine; stir-fry",pictophonetic,fire
烽,"beacon, signal fire",pictophonetic,fire
焉,"why? where? how?; strange; thereupon, then",ideographic,A bird 鳥 with a strange head
焊,"to solder, to weld",pictophonetic,fire
焌,"to ignite, to light",pictophonetic,fire
焐,to warm up,pictophonetic,fire
焓,"onomatopoetic, a fire sizzling",pictophonetic,fire
焗,"to bake, to roast; to suffocate; stuffy",pictophonetic,fire
焙,"to bake, to roast; to dry by the fire",pictophonetic,fire
焚,to burn,ideographic,Setting fire 火 to a forest 林
无,"no, not; lacking, -less",,
焢,"anger, rage; slow-braised pork belly",pictophonetic,fire
焦,"burned, scorched; anxious, vexed",ideographic,A bird 隹 getting its tail singed 灬
焯,to scald; to flash-boil vegetables,pictophonetic,fire
焰,"flame, blaze; glowing, blazing",pictophonetic,fire
焱,fierce flames; conflagration,ideographic,Many fires 火 burning
然,certainly; naturally; suddenly,pictophonetic,fire
煅,discipline; to forge metal; to hone a skill,pictophonetic,fire
煆,a raging fire; to forge; to work,pictophonetic,fire
炼,"to smelt, to refine; to distill, to condense",pictophonetic,fire
煊,warm,pictophonetic,fire
煌,"bright, shining, luminous",pictophonetic,fire
煎,to fry in fat or oil; to boil in water,pictophonetic,fire
煮,"to boil, to cook",pictophonetic,fire
炜,"brilliant, glowing, red",pictophonetic,fire
烟,"smoke, soot; opium; tobacco, cigarettes",pictophonetic,fire
煜,"brilliant, shining",ideographic,A dazzling 昱 flame 火; 昱 also provides the pronunciation
煞,"demon, fiend; baleful, noxious",,
茕,"alone, desolate; without friends or family",,
煤,"carbon, charcoal, coal, coke",pictophonetic,fire
焕,"shining, lustrous",pictophonetic,fire
煦,"kind, gentle, gracious",ideographic,A warm 昫 fire 灬; 昫 also provides the pronunciation
煨,"to simmer, to stew",pictophonetic,fire
烦,"to bother, to trouble, to vex",pictophonetic,fire
炀,"to scorch, to roast, to melt",pictophonetic,fire
煲,"to heat, to boil; saucepan",pictophonetic,fire
煳,burnt; to char (in cooking),ideographic,A reckless 胡 flame 火; 胡 also provides the pronunciation
煸,to stir-fry before broiling or stewing,pictophonetic,fire
煺,to pluck poultry; to skin meat,ideographic,To prepare 退 to cook 火; 退 also provides the pronunciation
煽,"to stir up, to incite; to agitate, to provoke",ideographic,To fan 扇 the flames 火; 扇 also provides the pronunciation
熄,"to extinguish, to put out, to quench",ideographic,To end 息 a flame 火; 息 also provides the pronunciation
熙,"bright, prosperous; splendid, glorious",pictophonetic,fire
熊,a bear; brilliant; surname,ideographic,A bear's 能 footprints 灬
熏,"to smoke, to cure meat; vapor, smoke, fog",pictophonetic,fire
荧,"to shine, to shimmer; shining, dazzling",pictophonetic,fire
熔,"mold; to fuse, to melt, to smelt",ideographic,To form 容 hot metal 火; 容 also provides the pronunciation
炝,to stir-fry; to cook in sauce,pictophonetic,fire
熘,"to steam, to stir-fry",pictophonetic,fire
熜,chimney; torch,pictophonetic,fire
熟,"well-cooked; ripe, mature; familiar with",pictophonetic,fire
熠,"bright, sparkling",pictophonetic,fire
熨,"to press, to iron; an iron",pictophonetic,fire
熬,"to boil, to simmer; to endure pain",pictophonetic,fire
热,"heat, fever, zeal",pictophonetic,fire
熳,to spread,pictophonetic,fire
熵,entropy,pictophonetic,fire
熹,"dim light, a glimmer; warm; bright",pictophonetic,fire
炽,"to burn, to blaze; splendid; intense",pictophonetic,fire
燃,"to ignite, to burn; combustion",pictophonetic,fire
灯,"lamp, lantern, light",pictophonetic,fire
炖,stew; to cook stew,pictophonetic,fire
燎,"to burn, to light; street lamp; signal fire",pictophonetic,fire
磷,phosphorus,pictophonetic,mineral
烧,"to burn, to bake; to heat, to roast",pictophonetic,fire
燔,to roast meat for a sacrifice,ideographic,To roast 火 meat on a spit 番; 番 also provides the pronunciation
燕,"lovebird, swallow",ideographic,"A swallow, with its head 廿, wings 北, and tail 灬"
烫,to scald; to iron clothes or hair,pictophonetic,fire
焖,"to simmer, to cook over a slow fire",pictophonetic,fire
营,"camp, barracks, army; to run, to manage",,
