form,meaning,type,etymology
⺮,bamboo; flute,pictographic,Two stalks of bamboo; see 竹
㐆,old form of 隱,,
㐌,a tribe of savages in South China,pictophonetic,people
俊,"talented, capable; handsome",pictophonetic,person
㒸,"to obey, to follow; year, season, harvest",,
罔,none; to deceive; to slander,pictophonetic,net
寇,"bandit, thief; enemy; to invade",ideographic,Bandits mugging 攴 a person 元 in his home 宀
㔾,seal; kneeling person,pictographic,A rolled-up scroll or kneeling person; compare 卩
却,"still, but; decline; retreat",pictophonetic,seal
厨,"kitchen; closet, cupboard",pictophonetic,building
参,"to take part in, to intervene; ginseng",pictophonetic,
以,according to; so as to; because of; then,,
坳,"cavity, depression, hollow; depressed; undulating",pictophonetic,earth
宿,"to stop, to rest, to lodge; constellation",ideographic,A person 亻 sleeping in a bed 百 under a roof 宀
冥,"dark, gloomy, night; deep",ideographic,"The sun 日, covered 冖, with 六 providing the pronunciation"
最,"most, extremely, exceedingly; superlative",ideographic,"To take place 取 under the sun 日 (that is, everywhere)"
㝵,"to obtain, to get, to acquire; ancient form of 得",ideographic,A hand 寸 grabbing a shell 旦
岸,"beach, coast, shore",ideographic,A mountain 山 cliff 厂; 干 provides the pronunciation
岛,island,ideographic,A bird 鸟 perched atop a mountain 山
帆,boat; to sail,pictophonetic,cloth
帽,"hat, cap",pictophonetic,towel
廉,"upright, honorable, honest",,
迥,"distant, far; separated; different",ideographic,Separated 辶 by a border 冋; 冋 also provides the pronunciation
恩,"kindness, mercy, charity",pictophonetic,heart
惬,"satisfied, comfortable, cheerful",pictophonetic,heart
㥯,"careful, prudent; compassionate; grieved; worried",pictophonetic,heart
拿,"to bring, to grasp, to hold, to take",pictophonetic,hand
捷,"nimble, quick; triumph, victory",pictophonetic,hand
晃,"bright, dazzling; to shake, to sway",pictophonetic,sun
据,"to possess, to occupy; position; base",pictophonetic,hand
携,"to carry, to lead, to take by the hand",pictophonetic,hand
散,"to scatter, to disperse, to break up",ideographic,A hand 攵 tossing seeds from a basket
敦,"honest, candid, sincere; kind-hearted; to esteem",pictophonetic,share
暖,"warm, genial",pictophonetic,sun
㬎,"motes in a sunbeam; illustrious, bright",ideographic,Tiny 幺 motes of dust 灬 in a sunbeam 日
橹,"oar, scull; to row, to scull",pictophonetic,wood
饮,"to swallow, to drink; a kind of drink",pictophonetic,food
㲋,"rabbit, hare",pictographic,A rabbit looking to the left
涎,saliva,pictophonetic,water
法,"law, rule, statute; method, way; French",ideographic,The course 去 followed by a stream 氵
深,"deep, profound; depth",ideographic,Deep 罙 water 氵
涧,"brook, mountain stream",ideographic,A stream 氵 flowing through a valley 间; 间 also provides the pronunciation
烨,"glorious, splendid; a blaze of fire",ideographic,A glorious 华 blaze 火; 华 also provides the pronunciation
碗,"bowl, small dish",pictophonetic,stone
留,"to stay, to remain; to preserve, to keep; to leave a message; ",,
瘪,"shriveled, dried up; vexed",pictophonetic,sickness
筲,"basket, bucket",pictophonetic,bamboo
糊,muddled; paste; to stick on with paste,pictophonetic,grain
䍃,"vase, pitcher, earthenware",pictographic,Pottery; compare 缶
䕭,"a kind of grass; a vegetable; nettle, Urtica",pictophonetic,grass
蜂,"bee, wasp, hornet",pictophonetic,insect
恤,"to help, to relieve, to take pity on",pictophonetic,heart
脉,"a pulse; arteries, veins; blood vessels",ideographic,Long 永 vessels through one's body ⺼
卒,"soldier; servant; at last, finally",pictographic,A soldier in armor
词,"phrase, expression; words, speech",pictophonetic,words
獾,badger,pictophonetic,animal
䠀,to meditate; to sit cross-legged,pictophonetic,foot
趟,"time, occasion; to make a journey",pictophonetic,walk
射,"to shoot, to eject, to emit",pictographic,A bow 身 being drawn by a hand 寸
镰,sickle,pictophonetic,metal
飒,bleak; melancholy; the howl of the wind,pictophonetic,wind
驮,to carry on one's back,pictophonetic,horse
魂,"soul, spirit",pictophonetic,spirit
鲃,shark; bonito,pictophonetic,fish
鹅,goose,pictophonetic,bird
鹮,"spoonbill, ibis; Threskiornidae",pictophonetic,bird
麸,bran,pictophonetic,wheat
衄,a bloody nose; to be defeated,ideographic,To be shamed 丑 by a bloody 血 nose
一,"one; a, an; alone",ideographic,"Represents heaven (天), earth (旦), or the number 1"
丁,"male adult; robust, vigorous; 4th heavenly stem",pictographic,A nail
丂,obstruction of breath (qi); variant of 考,,
七,seven,,
丄,above,ideographic,One stroke on top of another; variant of 上
万,ten thousand; innumerable,,
丈,"gentleman, man, husband; unit of length equal to 3.3 meters",,
三,three,ideographic,Three  parallel lines; compare 一 (one) and 二 (two)
上,"above, on top, superior; to go up; to attend; previous",ideographic,One stroke on top of another; compare 下 (below)
下,"below, underneath; inferior; to bring down; next",ideographic,One stroke under another; compare 上 (above)
丌,table,pictographic,A table
不,"no, not, un-; negative prefix",ideographic,A bird flying toward the sky 一
丏,"parapet; invisible, hidden",,
丐,beggar; to beg; to give,pictographic,A person leaning forward to ask for help
丑,"ugly; shameful; comedian, clown",,
且,"moreover, also (post-subject); about to, will soon (pre-verb)",pictographic,A stone altar
丕,"great, grand, glorious, distinguished",,
世,"generation, era, age; world",pictographic,Three leaves on a branch
丘,"mound, hill; surname",pictographic,Two hills
丙,third; 3rd heavenly stem,,
丞,"to aid, to assist, to rescue",pictophonetic,one
丢,to lose; to discard,ideographic,A lost 厶 jade 玉
并,"to combine, to annex; also, what's more",ideographic,Simplified form of 並; two men standing side-by-side
丨,number one; line,,
丩,"to connect, to join; vine",,
丫,forked; bifurcation,ideographic,A forked line 丨
中,"central; center, middle; amidst; to hit (target), to attain; China; Chinese",ideographic,A line 丨 through the center of a box 口
丰,"abundant, lush, bountiful, plenty",pictographic,An ear of grass
丱,a child's hair bound in two tufts; ore,pictographic,Two braids 丱 of hair
串,string; relatives; to conspire,ideographic,Two objects 口 strung 丨 together
丵,thick (grass),,
丶,dot,,
丷,kwukyel,,
丸,"ball, pebble, pellet, pill",pictographic,A fist 九 holding a pebble 丶
丹,"cinnabar, red, vermilion; pellet, powder",ideographic,A red pellet 丶 from a mine 井
主,to own; to host; master; host; lord,pictographic,A lamp 王 with a flame 丶
丿,slash,,
乂,to govern; to control; to nurture,ideographic,"Shears, for cultivating a garden"
乃,"then; really, indeed, after all",ideographic,A pregnant woman; compare 孕
久,long ago; a long time,,
乇,"to depend on, to entrust with",,
幺,"one; tiny, small",,
之,"marks preceding phrase as modifier of following phrase; it, him her, them; to go to",ideographic,"A foot meaning ""to follow""; cursive version of 止"
乍,"first time, for the first time, suddenly",,
乎,interrogative or exclamatory final particle,,
乏,"poor; short, lacking; tired",ideographic,A foot 之 running into a wall or barrier 丿
乑,to stand side by side,,
乒,used with pong for ping pong,ideographic,A ball bouncing back and forth; compare 乓
乓,used with ping for ping pong,ideographic,A ball bouncing back and forth; compare 乒
乖,"obedient, well-behaved; clever",,
乘,"ride, mount; to make use of; to ascend; to multiply",ideographic,Two feet 北 climbing a beanstalk 禾
乙,second; 2nd heavenly stem,pictographic,A swallow
乚,"secret, hidden, mysterious; small, minute; to conceal",,
乛,kwukyel,,
乜,to squint,,
九,nine,pictographic,An elbow
乞,to beg; to request,,
也,"also, too",,
乩,to divine,pictophonetic,divine
乳,"breast, nipples; milk; to suckle",pictophonetic,hidden
乶,"Pholha, a place in Korea",pictophonetic,second
乾,"arid, dry; to fertilize; to penetrate; heavenly generative principle (male)",ideographic,Rays 十 emanating from the 日; 乞 provides the pronunciation
干,"arid, dry; to oppose; to offend; to invade",pictographic,A club or axe
乿,"to heal, to cure",,
乱,"anarchy, chaos; revolt",,
亅,hook,,
了,clear; to finish; particle of completed action,pictographic,A child swaddled in blanklets; compare 子
予,to give; to award,,
事,"affair, matter, business; to serve; accident, incident",,
二,two; twice,ideographic,Two  parallel lines; compare 一 (one) and 三 (three)
亍,to take small steps; Korean place name,,
于,"at, in, on; to, from; alas!",,
云,"cloud; to say, to speak",pictographic,A cloud
互,"mutually, reciprocally",ideographic,Two hooks hooking eachother
亓,that; surname,,
五,five; surname,ideographic,Five elements (the cross with the extra stroke) between heaven 一 and earth 一 
井,"well, mine shaft, pit",pictographic,A mine or well
亘,"to extend across, through; from",ideographic,Stretching from heaven 一 to earth 一 
些,"little, few; rather, somewhat",pictophonetic,two
斋,"to fast, to abstain; a vegetarian diet",pictophonetic,culture
亚,Asia; second,pictographic,Picture of a cross-shaped house or temple
亟,"urgently, immediately, extremely",,
亠,"lid, cover; head",,
亡,"death, destruction; to lose; to perish",ideographic,A man 人 in a coffin; see 亾
亢,"high, proud; violent, excessive; skilled; surname",,
交,"to connect; to deliver, to exchange; to intersect; to mix",ideographic,A person with crossed (intersecting) legs
亥,12th terrestrial branch; used in transliterations,,
亦,"also, too; likewise",ideographic,A man standing with arrows pointing to his armpits
亨,"prospering, going smoothly",,
享,to share; to enjoy; to benefit from,ideographic,Children 子 living and eating 口 in the house 亠
京,capital city,pictographic,A capital building on a hill
亭,pavilion; erect,pictographic,"亠, 口, and 冖 form a picture of a pavilion; 丁 provides the pronunciation"
亮,"bright, brilliant, radiant, light",pictographic,A lit oil lamp
夜,"night, dark; under cover of night",ideographic,A person 亻 sneaking by under cover 亠 of night 夕
亳,name of district in Anhui; capital of Yin,,
亶,"real, sincere, true; truth",pictophonetic,
亹,busy; resolute; to exert; to make progress,,
人,"man, person; people",pictographic,The legs of a human being
亻,"man, person; people",ideographic,Visual abbreviation of 人
亼,"to assemble, to gather together",,
什,"what? mixed, miscellaneous",ideographic,A file of ten 十 people 亻
仁,"benevolent, humane, kind",ideographic,A caring relationship between two 二 people 亻
仂,"excess, remainder, surplus",pictophonetic,
仃,"lonely, solitary",pictophonetic,person
仄,"slanting, oblique; oblique tones",ideographic,A man 人 taking shelter in a lean-to 厂
仆,"to fall forward; prostrate, prone; servant",pictophonetic,person
仇,"enemy; hatred, enmity",pictophonetic,person
仉,mother; surname of the mother of Mencius,,
今,"modern, current; today, now",ideographic,A mouth 亼 talking about things
介,"agent, go-between, intermediary; to introduce; shell, armor",ideographic,A border 八 dividing people 人
仌,frozen; ice-cold,ideographic,"Old variant of 冰 (""ice-water"")"
仍,"yet, still; keeping, continuing; again",pictophonetic,then
从,"from, by, since, whence, through",ideographic,One person 人 following another
仔,"small thing, child; young animal",ideographic,A person 亻 keeping watch over a child 子; 子 also provides the pronunciation
仕,official; to serve in the government,pictophonetic,person
他,"other, another; he, she, it",ideographic,"An additional, ""also"" 也  person 亻"
仗,"1to rely upon; protector; to fight; war, weaponry",pictophonetic,person
付,"give, deliver, pay, hand over; entrust",ideographic,To hand 寸 something over to someone 亻 
仙,"god; fairy; immortal, transcendent",pictophonetic,person
仝,"together, same; surname",pictophonetic,person
仞,ancient unit of measure (about 8 feet); a fathom,pictophonetic,
仟,one thousand; leader of one thousand men,pictophonetic,people
仡,"strong; valiant, brave",,
代,"era, generation; to substitute for, to replace",ideographic,A man 亻 caught 弋 by the passing of time
令,"command, decree, order; magistrate; to allow, to cause",ideographic,A person kneeling before a master 人
仨,three (cannot be followed by a measure word),pictophonetic,three
仫,tribe,pictophonetic,people
仰,"raise the head to look; look up to, rely on, admire",ideographic,To exalt 卬 a person 亻
仲,"middle brother; go between, mediator; surname",ideographic,The middle 中 person 亻; 中 also provides the pronunciation
仳,"separate, part company",pictophonetic,person
仵,similar,pictophonetic,
件,"item, matter; component, part; measure word for events",ideographic,A man 亻 dividing up a cow 牛
任,"to trust, to rely on; to appoint; to bear; duty, office",pictophonetic,person
份,"job, part, role; duty",ideographic,The lot or portion 分 allotted to a man 亻
仿,"to imitate, to copy; fake; as if",pictophonetic,to imitate a person
企,to plan a project; to stand on tiptoe,ideographic,A man 人 on his feet 止; 止 also provides the pronunciation
伄,"seldom, irregularly",pictophonetic,person
伉,"husband, wife; pair; compare, match",pictophonetic,person
伊,"he she; this, that; used in transliterations",pictophonetic,person
伍,"five, company of five; troops",ideographic,Five 五 people 亻; 五 also provides the pronunciation
伎,"talent, skill, craft, ability",ideographic,A man 亻 who can support 支 someone
伏,"to crouch, to crawl, to lie hidden, to conceal",ideographic,A person 亻 acting like a dog 犬
伐,"cut down, subjugate, attack",ideographic,A person 亻 attacked 戈
休,to rest; to stop; to retire,ideographic,A person 亻 leaning against a tree 木
伕,manual laborer,ideographic,A working 夫 man 亻; 夫 also provides the pronunciation
伙,"companion, colleague; utensils",pictophonetic,person
伢,child,pictophonetic,person
伯,"older brother; father's elder brother; sir, sire, count",pictophonetic,person
估,"merchant; to estimate, to guess, to presume",pictophonetic,person
伲,we (Shanghai dialect),pictophonetic,people
伴,"companion, comrade, partner; to accompany",pictophonetic,person
伶,"clever; lonely, solitary",pictophonetic,person
伸,"to extend, to stretch out, to open up; to trust",ideographic,To extend your confidence 申 to another person 亻; 申 also provides the pronunciation
伺,"to serve, to wait upon, to attend; to examine",pictophonetic,person
似,"resembling, similar to; as if, to seem",ideographic,One person 亻 resembles another
伽,temple; used to transliterations,pictophonetic,person
伾,mighty,ideographic,A great 丕 man 亻; 丕 also provides the pronunciation
佃,tenant farmer; to be a tenant farmer,ideographic,A person 亻 on the farm 田; 田 also provides the pronunciation
但,"only; but, however, yet, still",pictophonetic,
伫,to wait; to look towards; to turn one's back on,,
布,"cotton, linen, textiles; to announce, to declare; to spread",ideographic,Cloth 巾 held in a hand
佉,the name of a divine being; surname,pictophonetic,person
位,"seat, throne; rank, status; position, location",ideographic,The place where a person 亻 stands 立
低,"low; to lower, to hang; to bend, to bow",pictophonetic,
住,"to reside, to live at, to dwell, to lodge; to stop",ideographic,A person 亻 who hosts 主; 主 also provides the pronunciation
佐,"to assist, to aid; subordinate, second",pictophonetic,person
佑,to help; to protect; to bless,pictophonetic,person
占,to divine; to observe; to versify,ideographic,To speak 口 omens ⺊
何,"what, why, where, which, how",,
佗,"other, he; surname; a load",ideographic,Another 它 person 亻; see 他 and 她 for modern variants
佘,surname,pictophonetic,person
余,"surplus, remainder; surname",,
佚,to indulge in pleasures; to flee,ideographic,To lose 失 a person 亻
佛,Buddha; Buddhist,pictophonetic,person
作,"to make; to write, to compose; to act, to perform",ideographic,A person 亻 making something for the first time 乍; 乍 also provides the pronunciation
佝,rickets,,
佞,flattery; glib,ideographic,Kindness 仁 toward a woman 女
佟,surname,pictophonetic,person
你,"you, second person pronoun",ideographic,Pronoun 尔 for a person 亻
佣,"to hire, to employ; commission; servant",ideographic,An employed 用 person 亻; 用 also provides the pronunciation
佤,The Va people (an ethnic group in Myanmar and southwest China),pictophonetic,people
佧,an ancient tribe in China,pictophonetic,people
佩,"belt ornament, pendant; wear at waist, tie to the belt; respect",ideographic,Common 凡 cloth 巾 ornaments worn by people 亻
佬,elder; mature,ideographic,An old 老 person 亻; 老 also provides the pronunciation
佯,"to pretend, to feign; false, deceitful",pictophonetic,person
佰,hundred,ideographic,One hundred 百 people 亻; 百 also provides the pronunciation
佳,"good, auspicious; beautiful; delightful",pictophonetic,person
佴,"a second, an assistant",ideographic,A second 耳 person 亻; 耳 also provides the pronunciation
佶,"strong, robust; exact, correct",pictophonetic,person
佻,"frivolous, unsteady; delay",,
佼,"beautiful, handsome, good-looking",pictophonetic,person
佽,"to help, to aid",pictophonetic,person
佾,a row or file of dancers,,
使,"cause, mission, orders; envoy, messenger, ambassador",ideographic,A person 亻 working for the government 吏
侃,upright and strong; amiable,ideographic,As trustworthy 㐰 as spring-water 川
侄,nephew,pictophonetic,person
来,"to arrive, to come, to return; in the future, later on",ideographic,A wheat plant that has not yet borne fruit; compare 來
侈,"luxurious, extravagant",ideographic,A person 亻 with more than they need 多
侉,to speak with an accent; big and clumsy,pictophonetic,person
例,"precedent, example, case; regulation",pictophonetic,person
侌,,pictophonetic,
侍,"to serve, to attend upon; servant, attendant; samurai",pictophonetic,person
侏,"small, tiny; dwarf",pictophonetic,person
侑,"help, assist, repay kindness",pictophonetic,person
侔,equal,pictophonetic,person
仑,"logical reasons, logical order",,
侗,"big; ignorant, rude, rustic",pictophonetic,person
供,"to supply, to provide for; to offer in worship",ideographic,A person 亻 making an offering with both hands 共; 共 also provides the pronunciation
依,"to rely on; to consent, to obey; according to",pictophonetic,person
侮,"insult, ridicule, disgrace",,
侯,"marquis, lord; target in archery",pictographic,A person 亻 who might be a target 矦
侵,"to invade, to encroach upon, to raid",,
侣,companion; associate with,pictophonetic,person
局,"bureau, office; circumstance, game, situation",ideographic,A place where measures 尺 are discussed 口
便,"easy, convenient; expedient",,
俣,big,pictophonetic,person
系,"system; line, link, connection",pictophonetic,thread
促,"to urge, to rush, to hurry; hasty; near, close",ideographic,Someone 亻 on your heels 足; 足 also provides the pronunciation
俄,"sudden, abrupt; used in transliterations",pictophonetic,
俅,ornamental cap,pictophonetic,
俉,scary; to frighten,pictophonetic,person
俎,chopping board or block; painted,pictographic,A slab of meat on a chopping board 且
俏,"to resemble; similar, alike; pretty",ideographic,A similar 肖 person 亻; 肖 also provides the pronunciation
俐,"smooth; active; clever, sharp",pictophonetic,person
俑,wooden figure buried with dead,pictophonetic,person
俗,"social customs; vulgar, unrefined",pictophonetic,person
俘,prisoner of war; take as prisoner,pictophonetic,person
俚,"rustic, vulgar, unpolished; mean",pictophonetic,person
俛,"to make an effort, to endeavor; to bear down",,
俯,"to bow down, to face down, to look down",pictophonetic,person
俜,to trust to; send a message,ideographic,A trusted 甹 person 亻;  甹 also provides the pronunciation
保,"to safeguard, to protect, to defend, to care for",pictophonetic,person
俞,"to consent, to approve; surname",,
俟,"wait for, wait until, as soon as",ideographic,A person 亻 waiting for something to finish 矣; 矣 also provides the pronunciation
侠,chivalrous person; knight-errant,pictophonetic,person
信,"to trust, to believe; letter, sign",,
修,to study; to repair; to decorate; to cultivate,pictophonetic,hair
俱,"all, together; accompany",pictophonetic,person
效,"result, effect; effective",pictophonetic,strike
俳,actor; vaudeville show; insincere,pictophonetic,person
俸,"wages, salary, official emolument",ideographic,Wages offered 奉 to a person 亻; 奉 also provides the pronunciation
俺,"I, me, my (some dialects)",pictophonetic,person
备,"to prepare; to get ready, to equip; ready; perfect",ideographic,To go 夂 to the farm 田 to prepare for a harvest
俾,"so that, in order that; to cause",pictophonetic,
伥,the ghost of one devoured by a tiger,pictophonetic,person
俩,"two, a pair, a couple",ideographic,A couple 寿; 寿 also provides the pronunciation
仓,"granary, barn; cabin, berth",ideographic,Simplified form of 倉; grains 食 kept in storage 口
个,"this, that; single; measure word for individuals",ideographic,A tally 丨 of people 人
倌,"assistant, hired hand",pictophonetic,person
倍,to double; to increase or multiply,,
倏,"hastily, suddenly, abruptly",pictophonetic,dog
们,plural marker for pronouns and some nouns,pictophonetic,people
倒,"to collapse, to fall over; to lie down",pictophonetic,person
倔,"stubborn, obstinate, intransigent; firm",ideographic,Someone 亻 who does not bend 屈; 屈 also provides the pronunciation
幸,"favor, fortune, luck; surname",ideographic,"Two men, one alive 土 and one dead 干; the living one is lucky"
倘,"if, supposing, in event of",pictophonetic,person
候,"to wait, to expect; to visit; to greet",pictophonetic,person
倚,"to rely on, to depend on",pictophonetic,person
倜,"lofty, exalted",,
倝,"sunrise, dawn",pictophonetic,sunlight
倞,far,ideographic,Someone 亻 living in the capital 京; 京 also provides the pronunciation
借,"to borrow; to lend; excuse, pretext",pictophonetic,person
倡,"guide, leader; lead, introduce",ideographic,Someone 亻 who lights the way 昌; 昌 also provides the pronunciation
倥,"boorish, ignorant; urgent, pressing",pictophonetic,person
倦,"tired, weary",ideographic,A curled-up 卷 person 亻; 卷 also provides the pronunciation
倨,"arrogant, haughty, rude",pictophonetic,person
倩,"beautiful, lovely; son-in-law",ideographic,A young 青 person 亻; 青 also provides the pronunciation
倪,"feeble, tiny, young and weak",ideographic,A young child 兒
伦,human relationships; society,ideographic,The logical order 仑 of human 亻 society; 仑 also provides the pronunciation
倬,"noticeable, large; distinct, clear",pictophonetic,person
倭,"dwarf; dwarfish, short",pictophonetic,person
倮,"bare, naked, uncovered",pictophonetic,person
睬,"to notice, to pay attention to",pictophonetic,eye
倻,used to transliterate Korean place names,pictophonetic,people
值,"price, value, worth",pictophonetic,person
偃,"to cease, to lay down, to lay off",pictophonetic,person
假,"fake, false, deceitful; vacation",ideographic,A false 叚 person 亻; 叚 also provides the pronunciation
偈,brave; martial; hasty; scudding,,
伟,"great, imposing; extraordinary",pictophonetic,person
偌,"thus, so, like, such",pictophonetic,person
偎,"to cling to, to cuddle, to embrace, to fondle",ideographic,To cling to someone 亻 in fear 畏; 畏 also provides the pronunciation
偏,"slanting, inclined; prejudiced",pictophonetic,person
偕,"together, accompanied by; in order",pictophonetic,person
做,"to work, to make; to act",ideographic,Someone 亻 who causes things to happen 故; 故 also provides the pronuncation
停,"to suspend, to halt, to delay; suitable",pictophonetic,person
健,"strong, robust, healthy; strength",ideographic,Someone 亻 who can build 建 things; 建 also provides the pronunciation
逼,"to bother, to pressure; to compel, to force",pictophonetic,walk
侧,"side; to slant, to lean, to incline",pictophonetic,person
侦,"to spy, to reconnoiter; detective",pictophonetic,person
偶,"accidentally, coincidently; mate, image, idol",pictophonetic,person
偷,"to steal; burglar, thief",pictophonetic,person
咱,"we, us",pictophonetic,mouth
伪,"false, counterfeit, bogus",pictophonetic,
傀,"great, gigantic; puppet",pictophonetic,person
傅,"tutor, teacher; to assist; surname",ideographic,Someone 亻 who lectures 尃; 尃 also provides the pronunciation
傈,the Lisu tribe,pictophonetic,people
傍,"beside, close, nearby; to depend on",ideographic,Someone 亻 by your side 旁; 旁 also provides the pronunciation
杰,"hero; heroic, outstanding",,
傕,used in old names,pictophonetic,person
伧,"vulgar person, country man",ideographic,A person 亻 from the farm 仓; 仓 also provides the pronunciation
伞,"umbrella, parasol, parachute",pictographic,An umbrella
家,"house, home, residence; family",pictophonetic,roof
傣,the Dai minority living in South China,pictophonetic,people
催,"to press, to urge",pictophonetic,person
