form,meaning,type,etymology
尴,embarrassed; ill-at-ease,pictophonetic,lame
尸,"body, corpse",pictographic,A man keeled over
尹,"to govern, to oversee; director",pictographic,A scepter
尺,"ruler, tape-measure; unit of length, about 1 ft.",ideographic,Picture of a man measuring by pacing
尻,"end of spine; buttocks, sacrum",pictophonetic,body
尼,Buddhist nun; used in transliterations,,
尾,"tail; extremity, end; back, rear",ideographic,A furry 毛 tail behind a body 尸
尿,urine; to urinate,ideographic,"A person, crouched 尸 passing water 水"
屁,"to break wind, to fart; the buttocks",pictophonetic,body
屄,vagina; to press up to; to force,ideographic,A hole 穴 in a woman's body 尸
居,"to live, to reside; to dwell; to sit",pictophonetic,door
届,"deadline; period; measure word for elections, meetings, and other events",,
屈,"to bend, to flex; bent, crooked, crouched",pictophonetic,corpse
屋,"building, house, shelter; room",ideographic,To stop 至 under a roof 尸 (variant of 厂)
屌,penis; to fuck,ideographic,Something hanging 吊 from the body 尸; 吊 also provides the pronunciation
屎,"stool, feces, dung",ideographic,"A person, crouched 尸 defecating 米; 米 also provides the pronunciation"
屏,"screen, shield; to put aside, to reject; to hold",pictophonetic,door
屐,wooden clogs,pictophonetic,step
屑,"bits, crumbs, scraps; fragments; not worthwhile",pictophonetic,body
屃,legendary hero; Herculean strength,ideographic,Simplified form of 屭; a strong 贔 body 尸
展,"to open, to unfold; to extend, to stretch",ideographic,Laying out clothes 㠭 for sale in a market 尸; compare 㠭
屙,to defecate,pictophonetic,body
屉,"drawer, tier; pad, screen, tray",,
屠,"to butcher, to slaughter; massacre",pictophonetic,corpse
屡,"frequently, often, again and again",pictophonetic,body
屣,"sandals, slippers",ideographic,A person 尸 walking 彳; 徙 also provides the pronunciation
层,"layer, floor, story, stratum",ideographic,Simplified form of 層; 曾 provides the pronunciation
履,"shoes; to walk, to tread",ideographic,A person 尸 walking 彳; 復 also provides the pronunciation
屦,straw sandals; to tread on,pictophonetic,step
属,"class, category, type; family; affiliated, belonging to",pictophonetic,body
屮,sprout,pictographic,A sprout
屯,"village, hamlet; camp; station",,
山,"mountain, hill, peak",pictographic,Three mountain peaks
屹,"to rise, to stand tall",pictophonetic,mountain
屺,a grassy knoll; a barren knoll,pictophonetic,mountain
屾,mountain range,ideographic,Two mountains 山; 山 also provides the pronunciation
岈,the name of a mountain,pictophonetic,mountain
岌,"perilous, hazardous; steep, high",pictophonetic,mountain
岍,the name of a mountain,pictophonetic,mountain
岐,"to diverge, to branch; the name of a mountain",pictophonetic,mountain
岑,"steep, precipitous; peak",pictophonetic,mountain
岔,"to diverge, to branch; junction, fork in the road",ideographic,A road being split 分 by a mountain 山
岜,rocky mountain,pictophonetic,mountain
冈,ridge or crest of hill,pictographic,"Simplified form of 岡, clouds 网 forming over a mountain 山"
岢,the name of a mountain,pictophonetic,mountain
岣,a hill in Hunan,pictophonetic,mountain
岩,cliff; rocks; mountain,ideographic,The rocks 石 that make up a mountain 山
岫,"mountain peak; cave, cavern",pictophonetic,mountain
岬,"cape; promontory, headland",pictophonetic,mountain
岭,"mountain ridge, mountain peak",pictophonetic,mountain
岱,the Daishan mountain in Shandong,pictophonetic,mountain
岳,mountain peak; surname,ideographic,A mountain 山 range surrounded by hills 丘
岵,a wooded hill,pictophonetic,mountain
岷,the Min mountains; the Min river,pictophonetic,mountain
峁,yellow dirt mount,pictophonetic,mountain
峇,"cave, cavern",pictophonetic,mountain
峋,"foothill, mountain range",pictophonetic,mountain
峒,a mountain in Gansu province,pictophonetic,mountain
峙,"to pile, to stack; to stand tall",pictophonetic,mountain
峨,lofty; the name of a mountain,pictophonetic,mountain
峪,"valley, ravine",ideographic,A mountain 山 by a valley 谷; 谷 also provides the pronunciation
峭,"steep, precipitous, rugged",pictophonetic,mountain
峰,"peak, summit; a camel's hump",pictophonetic,mountain
岘,steep hill; a mountain in Hubei,ideographic,A mountain 山 that affords a good view 见; 见 also provides the pronunciation
峻,"high, steep, towering; stern",pictophonetic,mountain
峡,"gorge, ravine, strait; isthmus",ideographic,The space between 夹 two mountains 山; 夹 also provides the pronunciation
崆,the Kongtong mountain,pictophonetic,mountain
崇,"high, dignified; to esteem, to honor",pictophonetic,mountain
崃,a mountain in Sichuan province,pictophonetic,mountain
崎,"rough, uneven; jagged, rugged",pictophonetic,mountain
昆,elder brother; descendants,ideographic,Two brothers 比 under the son 日
崒,rocky peaks; lofty; dangerous,pictophonetic,mountain
崔,"high, lofty, towering; surname",ideographic,A bird 隹 faced with a mountain 山
崖,"cliff, precipice; precipitous",ideographic,A mountain 山 precipice 厓; 厓 also provides the pronunciation
岗,post; position,pictophonetic,mountain
崛,towering; eminent; a sudden rise,pictophonetic,mountain
崞,a mountain in Shanxi,pictophonetic,mountain
峥,"high, lofty, noble; perilous, steep",pictophonetic,mountain
崤,a mountain in Henan,pictophonetic,mountain
崦,a mountain in Kansu where the sun is supposed to set at night,pictophonetic,mountain
崧,"tall mountain; lofty, eminent",pictophonetic,mountain
崩,"to rupture, to split apart; to collapse; death, demise",pictophonetic,mountain
岽,a mountain in Guangxi province,pictophonetic,mountain
崮,"mesa, plateau",pictophonetic,mountain
崴,"high, lofty, precipitous; to sprain",pictophonetic,mountain
崽,"child, servant; a diminutive",,
崾,a place name in Shanxi province,pictophonetic,mountain
嵇,a mountain in Henan; surname,pictophonetic,mountain
嵊,a district in Zhejiang,pictophonetic,mountain
嵋,the Omei mountain in Sichuan,pictophonetic,mountain
嵌,"valley, ravine; to fall into; to inlay, to set in",pictophonetic,mountain
岚,"mountain mist, mountain haze",ideographic,Wind 风 blowing off the mountain 山
岁,"year; years old, age; harvest",,
嵛,a county in the Shandong province,pictophonetic,mountain
嵞,a mountain in Zhejiang,pictophonetic,mountain
嵩,"high, lofty; one of the five peaks in Hunan",ideographic,A tall 高 mountain 山
嵫,a hill in Shantung,pictophonetic,mountain
嵬,"rugged, rocky, precipitous",pictophonetic,mountain
嵯,"high, towering; rugged, irregular",pictophonetic,mountain
嵴,"ridge, crest, apex",ideographic,The spine 脊 of a mountain 山 range; 脊 also provides the pronunciation
嵝,the Goulou mountain in Hunan,pictophonetic,mountain
嶂,cliff; the barrier formed by a mountain range,pictophonetic,mountain
崭,"new, bold; steep, high",pictophonetic,mountain
岖,"steep, sheer; rugged, rough",pictophonetic,mountain
崂,"Laoshan, a mountain in Shandong",pictophonetic,mountain
嶙,"precipitous, steep, tall",pictophonetic,mountain
嶝,mountain path,ideographic,A road that climbs 登 a mountain 山; 登 also provides the pronunciation
峤,tall pointed mountain,ideographic,A tall 乔 mountain 山; 乔 also provides the pronunciation
嶡,"mountainous, precipitous; a sacrificial offering",pictophonetic,mountain
峄,a range of peaks in Shandong and Jiangsu,pictophonetic,mountain
嶪,"high, steep; perilous",pictophonetic,mountain
岙,island,pictophonetic,mountain
嶷,a mountain range in Hunan province,pictophonetic,mountain
嵘,"high, lofty, steep, towering",pictophonetic,mountain
屿,island,pictophonetic,mountain
巂,a place name,pictophonetic,hot
岿,"grand, stately; secure, lasting",pictophonetic,mountain
巍,"high, lofty; eminent, majestic",pictophonetic,mountain
峦,mountain range; tall pointed mountain,pictophonetic,mountain
巅,"mountain peak, mountain top",ideographic,The top 颠 of a mountain 山; 颠 also provides the pronunciation
巛,"stream, river",pictographic,A river flowing
川,"stream, river",ideographic,A river's flow; compare 巛
州,"state, province, prefecture",ideographic,Islands within a river 川
巠,underground river; flowing water,pictophonetic,river
巡,"to cruise, to inspect, to patrol",ideographic,To walk 辶 by the river 巛; 巛 also provides the pronunciation
巢,"nest, living quarters in tree",ideographic,A nest 巛田 built in a tree 木
巤,a mouse's whiskers; a horse's mane; a fish's dorsal fin,ideographic,A mouse's 鼠 whiskers 巛
工,"labor, work; laborer, worker",pictographic,A spade or other workman's tool
左,"left; unorthodox, improper",pictographic,A left hand; compare 又
巧,"skillful, ingenious, clever",pictophonetic,work
巨,"large, huge, gigantic; chief",ideographic,A hand holding a large carpenter's square 工
巫,"wizard, sorcerer, witch, shaman",pictographic,A cross-shaped divining rod
差,"difference, gap; almost, nearly; in error; an officer",ideographic,Work 工 done by a sheep 羊; incompetence
巯,an atom group,pictophonetic,
己,"self, oneself; personal, private; 6th heavenly stem",pictographic,A loom woven with thread
已,"already; finished; to stop; then, afterwards",,
巳,the hours from 9 to 11; 6th terrestrial branch,,
巴,"to desire, to wish for",,
巷,"alley, lane",,
卺,nuptial wine cup,pictophonetic,seal
巽,"mild, modest, obedient; southeast; 5th of the 8 trigrams",,
巾,"cloth, curtain, handkerchief, towel",pictographic,A curtain or towel hanging from a rack
巿,"to revolve, to turn, to make a circuit",ideographic,A belt 一 made of cloth 巾
市,"city, town; market, fair; to trade",,
纸,paper,pictophonetic,silk
希,"rare; to hope for, to strive for; to expect",,
帑,treasury; public funds,ideographic,Records kept on cloth 巾 by servants 奴
帔,"cape, robe, skirt",pictophonetic,cloth
帕,"scarf, turban, veil, wrap",ideographic,A scarf 巾 used to maintain a girl's purity 巾
帖,"card, invite, notice; to fit snugly",ideographic,Writing on a cloth 巾
帘,the flag-sign of a tavern,ideographic,A curtain 巾 at the entrance to a cave 穴
帙,"book jacket; satchel, bag",pictophonetic,curtain
帚,"broom, broomstick",pictographic,A hand 巾 holding a broom with the head 彐 held up
帛,"silk, fabric; wealth, property",pictophonetic,cloth
帝,"supreme ruler, emperor; god",pictographic,An altar on which a sacrifice is being made
帅,"commander; commander-in-chief; handsome, smart",ideographic,An army officer carrying a weapon 刂 and a flag 巾
师,"teacher, professional, master",ideographic,To skillfully wield 帀 a knife 刂
裙,"skirt, petticoat, apron",pictophonetic,clothes
席,"seat, place; mat; banquet; to take a seat",ideographic,A cloth 巾 or straw 艹 mat in the house 广
帐,"tent, screen, mosquito net; debt, credit, account",pictophonetic,curtain
带,"belt, strap; band, ribbon; area, zone; to carry, to raise, to wear",ideographic,"A belt, creasing one's robe above 卅 but not below 巾"
帷,"curtain, screen, tent",pictophonetic,curtain
常,"common, general, normal; always, frequently, regularly",pictophonetic,cloth
帧,"picture, scroll; one of a pair",pictophonetic,cloth
帏,a curtain that forms a wall,pictophonetic,curtain
幄,tent; mosquito net,ideographic,A room 屋 made of cloth 巾; 屋 also provides the pronunciation
幅,"piece, roll, strip; breadth, width; measure word for textiles",ideographic,A roll 畐 of cloth 巾; 畐 also provides the pronunciation
帮,"to help, to assist; to support, to defend; party; gang",ideographic,A nation's 邦 flag 巾; 邦 also provides the pronunciation
幌,"curtain, cloth screen, signboard",pictophonetic,curtain
徽,"badge, crest, logo, insignia",,
幔,"curtain, screen, tent",pictophonetic,cloth
幕,"curtain, screen, tent; measure word for plays and shows",pictophonetic,curtain
帼,women's headgear; mourning cap,pictophonetic,cloth
帻,turban; conical cap,pictophonetic,towel
幛,a cloth or silken hanging scroll,ideographic,Writing 章 on cloth 巾; 章 also provides the pronunciation
幞,turban,pictophonetic,towel
帜,"flag, pennant, sign; to fasten",pictophonetic,curtain
幡,"pennant, banner, streamer, flag",pictophonetic,cloth
幢,carriage curtain; sun screen; tent; measure word for buildings,pictophonetic,curtain
币,"currency, coins, legal tender",ideographic,Bills written on silk 巾
帱,to cover up; curtain,pictophonetic,cloth
平,"flat, level, even; peaceful",pictographic,A leveling scale
年,year; anniversary; a person's age,ideographic,"A man 干 carrying grain, representing the annual harvest"
幻,"fantasy, illusion, mirage; imaginary",ideographic,"An inversion of 予, ""to give"""
幼,"infant, young child; immature",ideographic,One with little 幺 strength 力; 幺 also provides the pronunciation
幽,"quiet, secluded, tranquil; dark",ideographic,Small niches 幺 in the mountainside 山; 幺 also provides the pronunciation
广,"broad, vast, wide; building, house",ideographic,"A lean-to 厂, suggesting a building"
庀,to prepare; to regulate,pictophonetic,house
庄,"village, hamlet; villa, manor",pictophonetic,house
庇,"cover, shield; to protect, to shelter; to harbor",pictophonetic,house
床,"bed, couch; framework, chassis",ideographic,A house 广 made out of wood 木; 广 also provides the pronunciation
庋,"cupboard, pantry",pictophonetic,house
序,"order, sequence, series; preface",pictophonetic,wide
底,"bottom, underside; below, underneath",pictophonetic,building
庖,"kitchen; cooking, cuisine",pictophonetic,house
店,"shop, store; inn, hotel",pictophonetic,building
庚,age; 7th heavenly stem,,
府,"prefect; prefecture, government",pictophonetic,wide
庠,village school; teach,pictophonetic,building
庥,"shade; shelter, protection",pictophonetic,building
度,"degree, system; manner; to consider",ideographic,Twenty 廿 people 又 meeting inside a building 广 to deliberate
座,"seat; stand, base",ideographic,A wide 广 seat 坐; 坐 also provides the pronunciation
库,"armory, treasury, warehouse",ideographic,A stable 广 where carriages 车 are parked
庭,court; courtyard; spacious hall or yard,ideographic,A wide 广 couryard 廷; 廷 also provides the pronunciation
庳,a low-built house,ideographic,A low 卑 house 广
庵,Buddhist monastery or nunnery,ideographic,A building 广 where people remain 奄; 奄 also provides the pronunciation
庶,"numerous, various; multitude",ideographic,Many people 灬 (twenty or more 廿) in a house 广
康,"health; peace, quiet",ideographic,A home 广 with a servant 隶
庸,"usual, common, ordinary, mediocre",pictophonetic,
庹,the length of one's two outstretched arms,pictophonetic,wide
庾,granary; storehouse,pictophonetic,building
厢,"side-room, wing; theatre box",pictophonetic,building
厩,stable; barnyard,pictophonetic,building
厦,large building; mansion,pictophonetic,building
廊,"corridor, porch, veranda",pictophonetic,wide
廌,unicorn,pictophonetic,deer
廑,hut; careful,pictophonetic,house
廒,granary,pictophonetic,building
廓,"broad, wide; open; empty; outline",pictophonetic,wide
荫,"shade, shelter; to protect",ideographic,Shade 阴 provided by a tree 艹; 阴 also provides the pronunciation
廖,"deserted, empty, few; surname",ideographic,"The wind 翏 blowing over a vast, empty plain 广"
廛,"store, shop",pictophonetic,building
庙,"temple, shrine; imperial court",ideographic,A building 广 containing an altar 由
庑,"corridor, hallway; luxuriant",pictophonetic,house
废,to terminate; to discard; to abgrogate,pictophonetic,
廥,"granary, barn",ideographic,A building 广 where food is stored 會; 會 also provides the pronunciation
廨,office,pictophonetic,building
廪,granary; to stockpile,pictophonetic,building
庐,"hut, cottage; the name of a mountain",ideographic,A house 广 with an open door 户; 户 also provides the pronunciation
厅,"hall, central room",pictophonetic,spacious
廴,"to walk, to go; a place",pictographic,A man walking to the left
延,"to defer, to delay, to postpone; to extend, to prolong; surname",ideographic,A foot on the road 㢟 stopped in its tracks 丿
廷,courtyard,pictophonetic,place
迫,"to compel, to force; pressing, urgent",pictophonetic,walk
建,"to build, to erect; to establish, to found",pictophonetic,action
廾,two hands,ideographic,Two hands 十 side by side
廿,"twenty, twentieth",ideographic,Two tens 十 side by side
弁,conical cap worn during the Zhou dynasty,pictographic,Two hands 廾 putting the cap 厶 on someone's head
弄,"to do; to mock, to tease; to play with",ideographic,Two hands 廾 playing with a piece of jade 玉; 廾 also provides the pronunciation
弇,"to trap; to hide, to cover; narrow-necked",,
弈,Chinese chess,pictophonetic,hands
弊,"evil, bad, wrong; fraud, harm",ideographic,Two hands 廾 breaking something 敝; 敝 also provides the pronunciation
弋,"to catch, to arrest; to shoot with a bow",pictographic,Picture of an arrow shot from a bow
式,"formula, pattern, rule, style, system",ideographic,A craftsman using an awl 弋 and a measuring square 工
弑,"patricide, matricide",pictophonetic,murder
弓,"bow; curved, arched",pictographic,A bow aimed to the left
引,"to pull, to stretch; to draw; to attract",ideographic,To pull back a bow's 弓 drawstring 丨
弗,"not, negative",ideographic,Two arrows 丨 pulled across a bow
弘,"to enlarge, to expand; liberal, great",,
弛,"to loosen, to relax; to unstring a bow",pictophonetic,bow
弟,"young brother, junior",,
弦,bow string; string instrument; hypotenuse,pictophonetic,bow
弧,"arc, crescent; wooden bow",pictophonetic,bow
弩,"crossbow; an arrow falling, a downward stroke",pictophonetic,bow
弭,"to stop, to repress, to quell",,
弮,a repeating crossbow,pictophonetic,bow
弱,"weak, fragile, delicate",ideographic,Two shoots 弓 dying to frost 冫
弪,radian (mathematics),pictophonetic,bow
张,"to display; to expand, to open; to stretch; a sheet of paper",pictophonetic,bow
强,"strong, powerful, energetic",pictophonetic,bow
弼,"to aid, to help; to correct",,
彀,enough; quite,,
弹,"bullet, pellet, shell; elastic, springy",pictophonetic,bow
弥,"complete, extensive, full; to fill",pictophonetic,bow
弯,"bend, curve, turn",ideographic,Like 亦 a bow 弓
彐,snout,,
彑,snout,pictographic,A head-on view of a snout
录,"to copy, to record, to write down",pictographic,A brush used to record stories
彖,"hog, hedgehog, porcupine",ideographic,A pig 豕 with a long snout 彑
彗,comet; broomstick,ideographic,A hand 彐 holding a bamboo broom 丰
彘,swine,pictophonetic,snout
彝,"the Yi tribe; tripod; rule, nature",,
彟,to measure; to calculate,pictophonetic,measure
彡,hair; sunlight,pictographic,Tufts of hair
形,"form, shape; to appear; to describe; to look",ideographic,Sunlight 彡 streaming through a window 开
彤,"red, vermillion",pictophonetic,red
彦,elegant,pictophonetic,hair
彧,"cultured, refined; polished",,
彩,"color, hue; prize; brilliant; variegated",pictophonetic,hair
彪,tiger; a tiger's stripes; like a tiger,ideographic,A tiger's 虎 stripes 彡
雕,"to carve, to engrave; eagle, vulture",pictophonetic,bird
彬,"ornamental; cultivated, refined, well-bred",pictophonetic,hair
彭,name of an ancient country; surname,ideographic,The sound 彡 of drums 壴
彰,"clear, manifest, obvious",pictophonetic,sunlight
影,"shadow; image, reflection; photograph",pictophonetic,sunlight
彳,to step with the left foot,,
彷,"similar, alike; to resemble",pictophonetic,step
彸,"agitated, restless",pictophonetic,step
役,"servant, laborer; service; to serve",ideographic,A person walking over 彳 with food in hand 殳
彼,"that, those, the other",pictophonetic,step
往,"to go, to depart; past, former",pictophonetic,step
征,"to summon, to recruit; levy, tax; journey; invasion",pictophonetic,step
徂,"to advance, to go; to; die",pictophonetic,step
待,"to entertain, to receive, to treat; to delay, to wait",ideographic,To welcome someone arriving 彳 at the royal court 寺
徇,"to follow, to comply with; to display",pictophonetic,step
很,"very, quite, much",pictophonetic,step
徉,"to wander, to stray, to roam; to hesitate",pictophonetic,step
徊,"to linger, to pace; irresolute",ideographic,To pace 彳 back and forth 回; 回 also provides the pronunciation
律,"statute, principle, regulation",ideographic,To walk 彳 as required by law 聿
徐,"slowly, quietly, calmly; dignified, composed",pictophonetic,step
径,"path, diameter; straight, direct",pictophonetic,step
徒,"disciple, follower; only, merely; in vain",ideographic,To walk 走 in someone's footsteps 彳
得,"to obtain, to get, to acquire; suitable, proper; ready",ideographic,A hand 寸 grabbing a shell 旦
徘,"to dither, to pace; hesitant",pictophonetic,step
徙,"to move, to shift; to migrate",ideographic,To step 彳 out on a long journey 歨
徜,"to linger, to walk back and forth",pictophonetic,step
徕,"to entice, to solicit; to encourage customers to come",pictophonetic,step
御,"chariot; to drive, to ride; to manage",pictophonetic,step
遍,"everywhere, all over, throughout",pictophonetic,walk
徨,"doubtful, irresolute, vacillating",pictophonetic,step
复,"again, repeatedly; copy, duplicate; to restore, to return",ideographic,A person 亻 who goes  somewhere 夂 every day 日
循,"to obey, to follow, to comply with",pictophonetic,step
徭,conscripted labor,pictophonetic,step
微,"small, tiny, trifling; micro-",,
徯,"to await, to expect, to hope",pictophonetic,step
徴,to summon,ideographic,To march 彳 on the king's 王 orders 攵
徵,"to summon, to recruit; levy, tax; journey; invasion",pictophonetic,step
德,"ethics, morality; compassion, kindness",pictophonetic,heart
彻,"penetrating, pervasive; to penetrate, to pass through",pictophonetic,cut
徼,"border, frontier; to inspect, to patrol",pictophonetic,step
心,heart; mind; soul,pictographic,A heart
忄,heart; mind; soul,,
必,"surely, certainly; must; will",,
忉,grieving; distressed,pictophonetic,heart
忌,"jealous, envious; to fear; to shun",pictophonetic,heart
忍,"to endure, to bear, to suffer, to tolerate",ideographic,A knife 刃 piercing the heart 心; 刃 also provides the pronunciation
忐,"nervous, timorous",ideographic,A weight on 上 the heart 心
忑,"fearful, nervous, timid",ideographic,A weight under 下 the heart 心
忒,"excessive (in a bad way); to err, to make a mistake",pictophonetic,heart
忕,habit; accustomed to,pictophonetic,mind
忖,"to guess, to ponder, to suppose",pictophonetic,mind
志,"determination, will; mark, sign; to record, to write",ideographic,The mind 心 of a scholar 士; 士 also provides the pronunciation
忘,"to forget, to miss, to neglect, to overlook",pictophonetic,heart
忙,"busy, hurried, pressed for time",ideographic,A heart 忄 faced with death 亡; 亡 also provides the pronunciation
忝,"shame, disgrace; self-depreciation",pictophonetic,heart
忞,to psych up; to steel one's nerves,pictophonetic,heart
忠,"loyalty, devotion, fidelity",pictophonetic,heart
忡,"sad, grieving; distressed, uneasy",pictophonetic,heart
忤,disobedient; stubborn; wrong,pictophonetic,heart
忪,"calm, peaceful; quiet, tranquil",pictophonetic,heart
快,"speedy, rapid, quick; soon",ideographic,A decisive 夬 will 忄; 夬 also provides the pronunciation
忭,"pleased, delighted",pictophonetic,heart
忮,stubborn; perverse; aggressive,pictophonetic,heart
忱,"honesty, sincerity, zeal",pictophonetic,heart
忸,"blushing, bashful, ashamed",pictophonetic,heart
忻,"pleasant, joyful, delightful",pictophonetic,heart
忽,"suddenly, abruptly; to neglect",pictophonetic,heart
忿,"anger, fury; exasperation",pictophonetic,heart
怊,grieving,pictophonetic,heart
怍,ashamed,pictophonetic,heart
怎,what? why? how?,pictophonetic,heart
怏,"discontented, dispirited, sad",pictophonetic,heart
怒,"anger, passion, rage",pictophonetic,heart
怔,"frightened, startled, terrified",pictophonetic,heart
怕,"to fear, to be afraid of; apprehensive",pictophonetic,heart
怖,"frightened, terrified",pictophonetic,heart
怙,to rely on; to presume; father (formal),pictophonetic,heart
怛,grieving; worried,pictophonetic,heart
思,"to think, to ponder, to consider; final particle",ideographic,Weighing something with your mind 囟 (altered) and heart 心
怠,"idle; negligent, remiss; to neglect",pictophonetic,mind
怡,"gladness, joy, pleasure; harmony",pictophonetic,heart
急,"anxious, worried; hasty, quick; pressing, urgent",pictophonetic,heart
怦,"ardent, eager; impulsive, bold",pictophonetic,heart
性,"sex, nature, character; suffix converting a verb to an adjective",pictophonetic,heart
怨,"to blame, to complain, to hate; enmity, resentment",pictophonetic,heart
怩,"timid, shy; bashful, ashamed",pictophonetic,heart
怪,"unusual, strange, peculiar",,
怫,anxious; depressed; sorry,pictophonetic,heart
怯,"afraid, lacking in courage",pictophonetic,heart
恍,absent-minded; distracted; indistinct; seemingly,pictophonetic,heart
怵,"fearful, apprehensive; timid, shy",pictophonetic,heart
恁,"that, thus; such, like so",pictophonetic,heart
恂,"careful; honest, sincere; to trust",pictophonetic,heart
恃,"to trust, to rely on; to presume",pictophonetic,heart
恒,"constant, persistent, regular",ideographic,A constant 亘 heart 忄; 亘 also provides the pronunciation
恐,"fearful, apprehensive; to fear, to dread",pictophonetic,heart
恓,vexed,pictophonetic,
